{
  "schema_version": 1,
  "book": {
    "id": "harbinger-vol-1-omega-rising",
    "title": "Harbinger Vol 1 Omega Rising"
  },
  "source": {
    "sha256": "69975ea54b0a0d047a64151a22a2338fc1c330b51f7c2691b5f214ddce7cb979",
    "byte_size": 94015425,
    "page_count": 149
  },
  "render_profile": {
    "id": "render-e9c4c14ea687a39d",
    "format": "webp",
    "quality": 85,
    "long_edge_px": 2400,
    "resolution_policy": "fixed-long-edge",
    "thumbnail": {
      "format": "webp",
      "quality": 80,
      "long_edge_px": 360
    }
  },
  "selection": "sample",
  "page_order": [
    "p-69975ea54b0a0d047a64151a22a2338fc1c330b51f7c2691b5f214ddce7cb979-0011",
    "p-69975ea54b0a0d047a64151a22a2338fc1c330b51f7c2691b5f214ddce7cb979-0020",
    "p-69975ea54b0a0d047a64151a22a2338fc1c330b51f7c2691b5f214ddce7cb979-0023",
    "p-69975ea54b0a0d047a64151a22a2338fc1c330b51f7c2691b5f214ddce7cb979-0034",
    "p-69975ea54b0a0d047a64151a22a2338fc1c330b51f7c2691b5f214ddce7cb979-0037",
    "p-69975ea54b0a0d047a64151a22a2338fc1c330b51f7c2691b5f214ddce7cb979-0044",
    "p-69975ea54b0a0d047a64151a22a2338fc1c330b51f7c2691b5f214ddce7cb979-0052",
    "p-69975ea54b0a0d047a64151a22a2338fc1c330b51f7c2691b5f214ddce7cb979-0058",
    "p-69975ea54b0a0d047a64151a22a2338fc1c330b51f7c2691b5f214ddce7cb979-0059",
    "p-69975ea54b0a0d047a64151a22a2338fc1c330b51f7c2691b5f214ddce7cb979-0141"
  ],
  "pages": [
    {
      "id": "p-69975ea54b0a0d047a64151a22a2338fc1c330b51f7c2691b5f214ddce7cb979-0011",
      "pdf_page_number": 11,
      "width": 1561,
      "height": 2400,
      "rotation_degrees": 0,
      "orientation": "portrait",
      "page": {
        "path": "pages/p-69975ea54b0a0d047a64151a22a2338fc1c330b51f7c2691b5f214ddce7cb979-0011.webp",
        "sha256": "fd5448b6fb1653adbd03ce76c83071364930f47359567328748bf2690324fd66",
        "byte_size": 508142,
        "width": 1561,
        "height": 2400
      },
      "thumbnail": {
        "path": "thumbs/p-69975ea54b0a0d047a64151a22a2338fc1c330b51f7c2691b5f214ddce7cb979-0011.webp",
        "sha256": "33e3a1e3110a5a1bfd6782a1435de8726040118775f876aeeead13e177f74e6b",
        "byte_size": 26674,
        "width": 234,
        "height": 360
      }
    },
    {
      "id": "p-69975ea54b0a0d047a64151a22a2338fc1c330b51f7c2691b5f214ddce7cb979-0020",
      "pdf_page_number": 20,
      "width": 1561,
      "height": 2400,
      "rotation_degrees": 0,
      "orientation": "portrait",
      "page": {
        "path": "pages/p-69975ea54b0a0d047a64151a22a2338fc1c330b51f7c2691b5f214ddce7cb979-0020.webp",
        "sha256": "ecd12d3be836b12b6feb73dfd820921d90ac39ab6f57da65a93c7468c1325087",
        "byte_size": 517324,
        "width": 1561,
        "height": 2400
      },
      "thumbnail": {
        "path": "thumbs/p-69975ea54b0a0d047a64151a22a2338fc1c330b51f7c2691b5f214ddce7cb979-0020.webp",
        "sha256": "55845ca4185e8eca317181f9d0f96e7ec9470d761e0ba7c1ae1ed357d2bdc308",
        "byte_size": 26988,
        "width": 234,
        "height": 360
      }
    },
    {
      "id": "p-69975ea54b0a0d047a64151a22a2338fc1c330b51f7c2691b5f214ddce7cb979-0023",
      "pdf_page_number": 23,
      "width": 1561,
      "height": 2400,
      "rotation_degrees": 0,
      "orientation": "portrait",
      "page": {
        "path": "pages/p-69975ea54b0a0d047a64151a22a2338fc1c330b51f7c2691b5f214ddce7cb979-0023.webp",
        "sha256": "ea8d0b8a1d6faabe68b16f93e26d576a6c683b589994a5a90d2eba4a54d80d02",
        "byte_size": 342966,
        "width": 1561,
        "height": 2400
      },
      "thumbnail": {
        "path": "thumbs/p-69975ea54b0a0d047a64151a22a2338fc1c330b51f7c2691b5f214ddce7cb979-0023.webp",
        "sha256": "8635d95379c47e706173e6cafe449903dec60c43ce7e018cefff460279701224",
        "byte_size": 21836,
        "width": 234,
        "height": 360
      }
    },
    {
      "id": "p-69975ea54b0a0d047a64151a22a2338fc1c330b51f7c2691b5f214ddce7cb979-0034",
      "pdf_page_number": 34,
      "width": 1570,
      "height": 2400,
      "rotation_degrees": 0,
      "orientation": "portrait",
      "page": {
        "path": "pages/p-69975ea54b0a0d047a64151a22a2338fc1c330b51f7c2691b5f214ddce7cb979-0034.webp",
        "sha256": "d17250618b5d4a3701606b90659fb2d669a4899f3e518e60869f809067fe8293",
        "byte_size": 394498,
        "width": 1570,
        "height": 2400
      },
      "thumbnail": {
        "path": "thumbs/p-69975ea54b0a0d047a64151a22a2338fc1c330b51f7c2691b5f214ddce7cb979-0034.webp",
        "sha256": "72a6db44cf115f39569fd640419b1aa7492978bf34e373e894d090c1a2acada6",
        "byte_size": 21890,
        "width": 235,
        "height": 360
      }
    },
    {
      "id": "p-69975ea54b0a0d047a64151a22a2338fc1c330b51f7c2691b5f214ddce7cb979-0037",
      "pdf_page_number": 37,
      "width": 1561,
      "height": 2400,
      "rotation_degrees": 0,
      "orientation": "portrait",
      "page": {
        "path": "pages/p-69975ea54b0a0d047a64151a22a2338fc1c330b51f7c2691b5f214ddce7cb979-0037.webp",
        "sha256": "ffdc46b53fc0214af93d97e1568795ad56a0f55b82b867938043d80561f712af",
        "byte_size": 312814,
        "width": 1561,
        "height": 2400
      },
      "thumbnail": {
        "path": "thumbs/p-69975ea54b0a0d047a64151a22a2338fc1c330b51f7c2691b5f214ddce7cb979-0037.webp",
        "sha256": "f8f4f09f0b6e178152ecc8491051c65c240c289ddb61ea420736de1c7b52f4f8",
        "byte_size": 22448,
        "width": 234,
        "height": 360
      }
    },
    {
      "id": "p-69975ea54b0a0d047a64151a22a2338fc1c330b51f7c2691b5f214ddce7cb979-0044",
      "pdf_page_number": 44,
      "width": 1561,
      "height": 2400,
      "rotation_degrees": 0,
      "orientation": "portrait",
      "page": {
        "path": "pages/p-69975ea54b0a0d047a64151a22a2338fc1c330b51f7c2691b5f214ddce7cb979-0044.webp",
        "sha256": "89cd9152f84cd6f36f0c68d6a33d42a4ca8b7cf287b051aa1f3cf636ad76dd53",
        "byte_size": 320874,
        "width": 1561,
        "height": 2400
      },
      "thumbnail": {
        "path": "thumbs/p-69975ea54b0a0d047a64151a22a2338fc1c330b51f7c2691b5f214ddce7cb979-0044.webp",
        "sha256": "9ab0d7cd6711a557da33c4066b5eca538cd9b82faaf7ea610706547c6bf79a91",
        "byte_size": 17386,
        "width": 234,
        "height": 360
      }
    },
    {
      "id": "p-69975ea54b0a0d047a64151a22a2338fc1c330b51f7c2691b5f214ddce7cb979-0052",
      "pdf_page_number": 52,
      "width": 1561,
      "height": 2400,
      "rotation_degrees": 0,
      "orientation": "portrait",
      "page": {
        "path": "pages/p-69975ea54b0a0d047a64151a22a2338fc1c330b51f7c2691b5f214ddce7cb979-0052.webp",
        "sha256": "0ef62334c0f8a3dda1cc5852b9c8c8c5d0f2c8d2bf5be1ef4374513762cfbe81",
        "byte_size": 495400,
        "width": 1561,
        "height": 2400
      },
      "thumbnail": {
        "path": "thumbs/p-69975ea54b0a0d047a64151a22a2338fc1c330b51f7c2691b5f214ddce7cb979-0052.webp",
        "sha256": "a243025122e1b7468911076402cc943c279615c7b0701d80491f302e1877b82e",
        "byte_size": 24730,
        "width": 234,
        "height": 360
      }
    },
    {
      "id": "p-69975ea54b0a0d047a64151a22a2338fc1c330b51f7c2691b5f214ddce7cb979-0058",
      "pdf_page_number": 58,
      "width": 1561,
      "height": 2400,
      "rotation_degrees": 0,
      "orientation": "portrait",
      "page": {
        "path": "pages/p-69975ea54b0a0d047a64151a22a2338fc1c330b51f7c2691b5f214ddce7cb979-0058.webp",
        "sha256": "8863249121ab829469aaef26291e68f25fecdafd9d1f5ae6eca2f6a48c605e75",
        "byte_size": 399794,
        "width": 1561,
        "height": 2400
      },
      "thumbnail": {
        "path": "thumbs/p-69975ea54b0a0d047a64151a22a2338fc1c330b51f7c2691b5f214ddce7cb979-0058.webp",
        "sha256": "ead9bd24e65ec26cd0e73ac650c1100026c9d37bc7e0d92214731868260386d7",
        "byte_size": 23764,
        "width": 234,
        "height": 360
      }
    },
    {
      "id": "p-69975ea54b0a0d047a64151a22a2338fc1c330b51f7c2691b5f214ddce7cb979-0059",
      "pdf_page_number": 59,
      "width": 1561,
      "height": 2400,
      "rotation_degrees": 0,
      "orientation": "portrait",
      "page": {
        "path": "pages/p-69975ea54b0a0d047a64151a22a2338fc1c330b51f7c2691b5f214ddce7cb979-0059.webp",
        "sha256": "0864904d7a79976d6557307a91ff556cdf9e413119f9aafe6aa96dc9cead5d46",
        "byte_size": 347504,
        "width": 1561,
        "height": 2400
      },
      "thumbnail": {
        "path": "thumbs/p-69975ea54b0a0d047a64151a22a2338fc1c330b51f7c2691b5f214ddce7cb979-0059.webp",
        "sha256": "66f72b699c04739a34508aeae32b0e8ac026e2f345fb68d589885665eea8e55b",
        "byte_size": 20694,
        "width": 234,
        "height": 360
      }
    },
    {
      "id": "p-69975ea54b0a0d047a64151a22a2338fc1c330b51f7c2691b5f214ddce7cb979-0141",
      "pdf_page_number": 141,
      "width": 2400,
      "height": 1846,
      "rotation_degrees": 0,
      "orientation": "landscape",
      "page": {
        "path": "pages/p-69975ea54b0a0d047a64151a22a2338fc1c330b51f7c2691b5f214ddce7cb979-0141.webp",
        "sha256": "66947bfe01bafbeab054bacb0b95a9fd361c9cadd0ef5b826b28e882a320a233",
        "byte_size": 622448,
        "width": 2400,
        "height": 1846
      },
      "thumbnail": {
        "path": "thumbs/p-69975ea54b0a0d047a64151a22a2338fc1c330b51f7c2691b5f214ddce7cb979-0141.webp",
        "sha256": "d5e42e28ea037c0dd3d560e838caa6c104ae6fdb6ed90c8dbe7528abf4b94ab5",
        "byte_size": 30206,
        "width": 360,
        "height": 277
      }
    }
  ]
}
