{
  "schema_version": 1,
  "book": {
    "id": "archer-armstrong-vol-1-the-michelangelo-code",
    "title": "Archer  Armstrong Vol 1 The Michelangelo Code"
  },
  "source": {
    "sha256": "53ef05d949a1e0c98472e19008ce052214dc4b4c776d1f87aeb8fe720ae1222a",
    "byte_size": 68357268,
    "page_count": 111
  },
  "render_profile": {
    "id": "render-e9c4c14ea687a39d",
    "format": "webp",
    "quality": 85,
    "long_edge_px": 2400,
    "resolution_policy": "fixed-long-edge",
    "thumbnail": {
      "format": "webp",
      "quality": 80,
      "long_edge_px": 360
    }
  },
  "selection": "sample",
  "page_order": [
    "p-53ef05d949a1e0c98472e19008ce052214dc4b4c776d1f87aeb8fe720ae1222a-0007",
    "p-53ef05d949a1e0c98472e19008ce052214dc4b4c776d1f87aeb8fe720ae1222a-0010",
    "p-53ef05d949a1e0c98472e19008ce052214dc4b4c776d1f87aeb8fe720ae1222a-0017",
    "p-53ef05d949a1e0c98472e19008ce052214dc4b4c776d1f87aeb8fe720ae1222a-0033",
    "p-53ef05d949a1e0c98472e19008ce052214dc4b4c776d1f87aeb8fe720ae1222a-0049",
    "p-53ef05d949a1e0c98472e19008ce052214dc4b4c776d1f87aeb8fe720ae1222a-0054",
    "p-53ef05d949a1e0c98472e19008ce052214dc4b4c776d1f87aeb8fe720ae1222a-0067",
    "p-53ef05d949a1e0c98472e19008ce052214dc4b4c776d1f87aeb8fe720ae1222a-0080",
    "p-53ef05d949a1e0c98472e19008ce052214dc4b4c776d1f87aeb8fe720ae1222a-0091",
    "p-53ef05d949a1e0c98472e19008ce052214dc4b4c776d1f87aeb8fe720ae1222a-0095"
  ],
  "pages": [
    {
      "id": "p-53ef05d949a1e0c98472e19008ce052214dc4b4c776d1f87aeb8fe720ae1222a-0007",
      "pdf_page_number": 7,
      "width": 1561,
      "height": 2400,
      "rotation_degrees": 0,
      "orientation": "portrait",
      "page": {
        "path": "pages/p-53ef05d949a1e0c98472e19008ce052214dc4b4c776d1f87aeb8fe720ae1222a-0007.webp",
        "sha256": "e381f7811e729d706a22652cbb1d11b2bceed64857e3c3545fe884f01321774f",
        "byte_size": 359368,
        "width": 1561,
        "height": 2400
      },
      "thumbnail": {
        "path": "thumbs/p-53ef05d949a1e0c98472e19008ce052214dc4b4c776d1f87aeb8fe720ae1222a-0007.webp",
        "sha256": "1d1af2fb6b9ecb664295785eb21efea355fbc4b2c3f5b7b37df7757bef2925b1",
        "byte_size": 19464,
        "width": 234,
        "height": 360
      }
    },
    {
      "id": "p-53ef05d949a1e0c98472e19008ce052214dc4b4c776d1f87aeb8fe720ae1222a-0010",
      "pdf_page_number": 10,
      "width": 1561,
      "height": 2400,
      "rotation_degrees": 0,
      "orientation": "portrait",
      "page": {
        "path": "pages/p-53ef05d949a1e0c98472e19008ce052214dc4b4c776d1f87aeb8fe720ae1222a-0010.webp",
        "sha256": "94a403cd2aefd7fe6bcb73da19a847e5f7ce4bfff3b1b1a482b1aa1b57b7dc77",
        "byte_size": 380330,
        "width": 1561,
        "height": 2400
      },
      "thumbnail": {
        "path": "thumbs/p-53ef05d949a1e0c98472e19008ce052214dc4b4c776d1f87aeb8fe720ae1222a-0010.webp",
        "sha256": "30ef6530f4010d3359dadba10f21abbeba9da3a67fb21a504ce268aba92d833c",
        "byte_size": 21714,
        "width": 234,
        "height": 360
      }
    },
    {
      "id": "p-53ef05d949a1e0c98472e19008ce052214dc4b4c776d1f87aeb8fe720ae1222a-0017",
      "pdf_page_number": 17,
      "width": 1561,
      "height": 2400,
      "rotation_degrees": 0,
      "orientation": "portrait",
      "page": {
        "path": "pages/p-53ef05d949a1e0c98472e19008ce052214dc4b4c776d1f87aeb8fe720ae1222a-0017.webp",
        "sha256": "b5664c2f6f29f8e691c82515f0e28fd9b989665c6e6f7d950eb66cd1438a948a",
        "byte_size": 386672,
        "width": 1561,
        "height": 2400
      },
      "thumbnail": {
        "path": "thumbs/p-53ef05d949a1e0c98472e19008ce052214dc4b4c776d1f87aeb8fe720ae1222a-0017.webp",
        "sha256": "04a4578fe2288bbea2a3ca121da5b0f14478045260a0f960b80847ad4b81e1d5",
        "byte_size": 21148,
        "width": 234,
        "height": 360
      }
    },
    {
      "id": "p-53ef05d949a1e0c98472e19008ce052214dc4b4c776d1f87aeb8fe720ae1222a-0033",
      "pdf_page_number": 33,
      "width": 1561,
      "height": 2400,
      "rotation_degrees": 0,
      "orientation": "portrait",
      "page": {
        "path": "pages/p-53ef05d949a1e0c98472e19008ce052214dc4b4c776d1f87aeb8fe720ae1222a-0033.webp",
        "sha256": "16924796ee4b13f5574883df6fe67a26fdf04c7d0ef6e233fe30fa5012b7ee2e",
        "byte_size": 333994,
        "width": 1561,
        "height": 2400
      },
      "thumbnail": {
        "path": "thumbs/p-53ef05d949a1e0c98472e19008ce052214dc4b4c776d1f87aeb8fe720ae1222a-0033.webp",
        "sha256": "6d157e2f2013ae20df0cf9f29d2dfe156bd7cd671fc130fb2f4f8fe6aaf73e37",
        "byte_size": 18768,
        "width": 234,
        "height": 360
      }
    },
    {
      "id": "p-53ef05d949a1e0c98472e19008ce052214dc4b4c776d1f87aeb8fe720ae1222a-0049",
      "pdf_page_number": 49,
      "width": 1561,
      "height": 2400,
      "rotation_degrees": 0,
      "orientation": "portrait",
      "page": {
        "path": "pages/p-53ef05d949a1e0c98472e19008ce052214dc4b4c776d1f87aeb8fe720ae1222a-0049.webp",
        "sha256": "3f0c64f3857a0e3feb684836f5db1fe43aeb4e87ec7b73c8721500234bf49da0",
        "byte_size": 338380,
        "width": 1561,
        "height": 2400
      },
      "thumbnail": {
        "path": "thumbs/p-53ef05d949a1e0c98472e19008ce052214dc4b4c776d1f87aeb8fe720ae1222a-0049.webp",
        "sha256": "ce1f3af07280e66ddd14cf9cfe4d8c7a7ed44378e70337ada589e1d218d9278b",
        "byte_size": 18234,
        "width": 234,
        "height": 360
      }
    },
    {
      "id": "p-53ef05d949a1e0c98472e19008ce052214dc4b4c776d1f87aeb8fe720ae1222a-0054",
      "pdf_page_number": 54,
      "width": 1561,
      "height": 2400,
      "rotation_degrees": 0,
      "orientation": "portrait",
      "page": {
        "path": "pages/p-53ef05d949a1e0c98472e19008ce052214dc4b4c776d1f87aeb8fe720ae1222a-0054.webp",
        "sha256": "c7d9e0b07b77c2fbf049b0a3717879d82270cc21ef2ad1c921770cc058bf93f1",
        "byte_size": 353262,
        "width": 1561,
        "height": 2400
      },
      "thumbnail": {
        "path": "thumbs/p-53ef05d949a1e0c98472e19008ce052214dc4b4c776d1f87aeb8fe720ae1222a-0054.webp",
        "sha256": "324d1f9693636fd1a3f3e1cbc0bcd4b79a1f23b3e0b0b2e5e2d2499ae94c58a2",
        "byte_size": 20840,
        "width": 234,
        "height": 360
      }
    },
    {
      "id": "p-53ef05d949a1e0c98472e19008ce052214dc4b4c776d1f87aeb8fe720ae1222a-0067",
      "pdf_page_number": 67,
      "width": 1561,
      "height": 2400,
      "rotation_degrees": 0,
      "orientation": "portrait",
      "page": {
        "path": "pages/p-53ef05d949a1e0c98472e19008ce052214dc4b4c776d1f87aeb8fe720ae1222a-0067.webp",
        "sha256": "6f08719e037b0e05bdca69409ff9ba62514071fe6a38c2c2cab26e0be7e7501a",
        "byte_size": 377402,
        "width": 1561,
        "height": 2400
      },
      "thumbnail": {
        "path": "thumbs/p-53ef05d949a1e0c98472e19008ce052214dc4b4c776d1f87aeb8fe720ae1222a-0067.webp",
        "sha256": "fe142a51f6168b2782be13e66ead13ca711e0fa78269f9bbbc1bb90a41ca864a",
        "byte_size": 22656,
        "width": 234,
        "height": 360
      }
    },
    {
      "id": "p-53ef05d949a1e0c98472e19008ce052214dc4b4c776d1f87aeb8fe720ae1222a-0080",
      "pdf_page_number": 80,
      "width": 1561,
      "height": 2400,
      "rotation_degrees": 0,
      "orientation": "portrait",
      "page": {
        "path": "pages/p-53ef05d949a1e0c98472e19008ce052214dc4b4c776d1f87aeb8fe720ae1222a-0080.webp",
        "sha256": "be1e7d4c86f0d887a9d5be9ea6fc9d36bb09f3ba8d87e8a0f138cdcf930e2af5",
        "byte_size": 296854,
        "width": 1561,
        "height": 2400
      },
      "thumbnail": {
        "path": "thumbs/p-53ef05d949a1e0c98472e19008ce052214dc4b4c776d1f87aeb8fe720ae1222a-0080.webp",
        "sha256": "128efb852750306ce891def71c79bb3f845de65e8738e454342b859cd637c502",
        "byte_size": 18408,
        "width": 234,
        "height": 360
      }
    },
    {
      "id": "p-53ef05d949a1e0c98472e19008ce052214dc4b4c776d1f87aeb8fe720ae1222a-0091",
      "pdf_page_number": 91,
      "width": 1561,
      "height": 2400,
      "rotation_degrees": 0,
      "orientation": "portrait",
      "page": {
        "path": "pages/p-53ef05d949a1e0c98472e19008ce052214dc4b4c776d1f87aeb8fe720ae1222a-0091.webp",
        "sha256": "85e7e9b9251f7ffe5d4e715e148660fe35c90ca9ac14f25754e6362a3a4efb97",
        "byte_size": 479744,
        "width": 1561,
        "height": 2400
      },
      "thumbnail": {
        "path": "thumbs/p-53ef05d949a1e0c98472e19008ce052214dc4b4c776d1f87aeb8fe720ae1222a-0091.webp",
        "sha256": "86172ae1251a33dc5e219e6526800540254142ca6afabb51aa697cf75b23304a",
        "byte_size": 26810,
        "width": 234,
        "height": 360
      }
    },
    {
      "id": "p-53ef05d949a1e0c98472e19008ce052214dc4b4c776d1f87aeb8fe720ae1222a-0095",
      "pdf_page_number": 95,
      "width": 1561,
      "height": 2400,
      "rotation_degrees": 0,
      "orientation": "portrait",
      "page": {
        "path": "pages/p-53ef05d949a1e0c98472e19008ce052214dc4b4c776d1f87aeb8fe720ae1222a-0095.webp",
        "sha256": "7d7e1d62df9766a0faf4c311d32600f4ab2d9910cc72c4bf44e8d3a3383de7e0",
        "byte_size": 297644,
        "width": 1561,
        "height": 2400
      },
      "thumbnail": {
        "path": "thumbs/p-53ef05d949a1e0c98472e19008ce052214dc4b4c776d1f87aeb8fe720ae1222a-0095.webp",
        "sha256": "b797552cd20cca954cff70b455cece7fd528e56941e277bed7f215a94eb4ad0b",
        "byte_size": 19454,
        "width": 234,
        "height": 360
      }
    }
  ]
}
